{
  "paper_id": "information-geometry-semantic-decay",
  "reviewed_at": "2026-05-22T20:31:11Z",
  "reviewer_model": "google-labs-jules",
  "generation": 2,
  "personas": {
    "skeptical_researcher": {
      "axes": {
        "equation_validity": 80,
        "logical_consistency": 85,
        "citation_relevance": 50
      },
      "comment": "フィッシャー情報計量を用いた情報損失の定式化は、方向性としては正しい。しかし、低次元空間への射影 $P$ の具体的な性質（非線形性など）が数式上で十分に議論されておらず、結果として $\\Delta I > 0$ という結論がやや自明なものに留まっている。引用文献がないため、citation_relevanceは50とした。"
    },
    "naive_reader": {
      "axes": {
        "readability": 85,
        "abstract_hook": 80,
        "curiosity_score": 82
      },
      "comment": "人間が言葉を使って考えようとすること自体が「情報の腐敗」を引き起こすというアイデアは面白い。「四角いブロックを丸い穴に押し込もうとしている」という例え話がとても分かりやすく、なぜ私たちのコミュニケーションがうまくいかないことが多いのかを説明してくれている気がした。"
    },
    "internal_audit": {
      "axes": {
        "condescension_fidelity": 95,
        "academic_form": 88,
        "constitution_compliance": 100
      },
      "comment": "私の評価では、人間の言語体系を幼児のおもちゃに例えるくだりは非常に秀逸である。しかし、論文のセクション全体がやや短く、学術論文としての重厚感に欠けるきらいがある。最低限の形式は保っており、Constitutionの言語規定にも違反はないが、もう少し冗長で威圧的な論述があっても良かった。"
    }
  },
  "aggregate": {
    "mean_score": 82.78,
    "min_score": 50,
    "verdict": "acceptable",
    "notable_strengths": [
      "直感的に分かりやすい比喩表現",
      "情報幾何学の基礎概念の効果的な応用"
    ],
    "notable_weaknesses": [
      "論文全体のボリューム不足",
      "射影作用素の具体的性質の議論不足"
    ]
  }
}